{
  "schemaVersion": "1",
  "reportKind": "matcher-v3-to-v3.1-delta",
  "inputHashes": {
    "matcherV3HistoryChecksumManifestSha256": "39f880e379dc08dc94945bf31eda2c72b13a0f281f54e3e0528b7d04ba677a0c",
    "matcherV3ReportSha256": "c9411e318678412ae757739749a58a999aa0fc6640b6a76460b4b59ad083dd99",
    "matcherV31ReportSha256": "c1237ba0af8684eafbed5fc295606c09a0cce012c6e7a9febfed2f6a5a080f8e",
    "holdoutManifestSha256": "b9cf6325e2758889449aa021b5b45b3636e17a0dcf65d3c7dba215c2964fe379"
  },
  "matcherV3": {
    "evaluation": {
      "repositoryCommitSha": "29ea23e0e9b0b85269d3eaaa52ccf3c7a91da30b",
      "sourceTreeSha256": "4a6b69ed50a96334fbcf949eda7a044d14f4d9c7405e7641567ff84d604f6486",
      "sarifRegressToolVersion": "0.1.0",
      "matcherAlgorithmVersion": "sarifregress/matcher/v3",
      "fingerprintAlgorithmVersions": [
        {
          "name": "derived-fingerprint",
          "version": "rule-path-context/v2"
        },
        {
          "name": "derived-fingerprint-compare",
          "version": "sarifregress/derived-fingerprint-compare/v2"
        },
        {
          "name": "embedded-snippet",
          "version": "embedded-snippet/v1"
        },
        {
          "name": "producer-fingerprint-common",
          "version": "sarifregress/producer-fingerprint-common-version/v1"
        }
      ],
      "outputSchemaVersion": "1",
      "configurationSchemaVersion": "1",
      "holdoutManifestSha256": "b9cf6325e2758889449aa021b5b45b3636e17a0dcf65d3c7dba215c2964fe379"
    },
    "aggregate": {
      "groundTruthUnits": 99,
      "labelledRelationships": 75,
      "labelledMatches": 50,
      "truePositives": 50,
      "falsePositives": 0,
      "falseNegatives": 25,
      "classificationMismatches": 5,
      "expectedNewClassifications": 9,
      "newClassifications": 36,
      "correctNewClassifications": 9,
      "incorrectNewClassifications": 0,
      "newClassificationAccuracy": 1,
      "expectedResolvedClassifications": 9,
      "resolvedClassifications": 36,
      "correctResolvedClassifications": 9,
      "incorrectResolvedClassifications": 0,
      "resolvedClassificationAccuracy": 1,
      "ambiguousClassifications": 8,
      "correctAmbiguityRefusals": 4,
      "unexpectedAmbiguityRefusals": 0,
      "incorrectlyAutoMatchedAmbiguousCases": 0,
      "ingestionFailures": 0,
      "structuralFailures": 0,
      "precision": 1,
      "recall": 0.666667,
      "f1": 0.800000
    },
    "producers": [
      {
        "producerId": "gitleaks",
        "metrics": {
          "groundTruthUnits": 33,
          "labelledRelationships": 25,
          "labelledMatches": 25,
          "truePositives": 25,
          "falsePositives": 0,
          "falseNegatives": 0,
          "classificationMismatches": 5,
          "expectedNewClassifications": 3,
          "newClassifications": 3,
          "correctNewClassifications": 3,
          "incorrectNewClassifications": 0,
          "newClassificationAccuracy": 1,
          "expectedResolvedClassifications": 3,
          "resolvedClassifications": 3,
          "correctResolvedClassifications": 3,
          "incorrectResolvedClassifications": 0,
          "resolvedClassificationAccuracy": 1,
          "ambiguousClassifications": 4,
          "correctAmbiguityRefusals": 2,
          "unexpectedAmbiguityRefusals": 0,
          "incorrectlyAutoMatchedAmbiguousCases": 0,
          "ingestionFailures": 0,
          "structuralFailures": 0,
          "precision": 1,
          "recall": 1,
          "f1": 1
        }
      },
      {
        "producerId": "pmd",
        "metrics": {
          "groundTruthUnits": 33,
          "labelledRelationships": 25,
          "labelledMatches": 0,
          "truePositives": 0,
          "falsePositives": 0,
          "falseNegatives": 25,
          "classificationMismatches": 0,
          "expectedNewClassifications": 3,
          "newClassifications": 30,
          "correctNewClassifications": 3,
          "incorrectNewClassifications": 0,
          "newClassificationAccuracy": 1,
          "expectedResolvedClassifications": 3,
          "resolvedClassifications": 30,
          "correctResolvedClassifications": 3,
          "incorrectResolvedClassifications": 0,
          "resolvedClassificationAccuracy": 1,
          "ambiguousClassifications": 0,
          "correctAmbiguityRefusals": 0,
          "unexpectedAmbiguityRefusals": 0,
          "incorrectlyAutoMatchedAmbiguousCases": 0,
          "ingestionFailures": 0,
          "structuralFailures": 0,
          "precision": 1,
          "recall": 0,
          "f1": 0
        }
      },
      {
        "producerId": "semgrep",
        "metrics": {
          "groundTruthUnits": 33,
          "labelledRelationships": 25,
          "labelledMatches": 25,
          "truePositives": 25,
          "falsePositives": 0,
          "falseNegatives": 0,
          "classificationMismatches": 0,
          "expectedNewClassifications": 3,
          "newClassifications": 3,
          "correctNewClassifications": 3,
          "incorrectNewClassifications": 0,
          "newClassificationAccuracy": 1,
          "expectedResolvedClassifications": 3,
          "resolvedClassifications": 3,
          "correctResolvedClassifications": 3,
          "incorrectResolvedClassifications": 0,
          "resolvedClassificationAccuracy": 1,
          "ambiguousClassifications": 4,
          "correctAmbiguityRefusals": 2,
          "unexpectedAmbiguityRefusals": 0,
          "incorrectlyAutoMatchedAmbiguousCases": 0,
          "ingestionFailures": 0,
          "structuralFailures": 0,
          "precision": 1,
          "recall": 1,
          "f1": 1
        }
      }
    ]
  },
  "matcherV31": {
    "evaluation": {
      "repositoryCommitSha": "863210dfda02690b0d9ee579f5d7fd7a45545b1e",
      "sourceTreeSha256": "fa14cb54282345aa2cc16e4a931d79ba651282f4b3355dc09df51fa05212694f",
      "sarifRegressToolVersion": "0.1.0",
      "matcherAlgorithmVersion": "sarifregress/matcher/v3.1",
      "fingerprintAlgorithmVersions": [
        {
          "name": "derived-fingerprint",
          "version": "rule-path-context/v2"
        },
        {
          "name": "derived-fingerprint-compare",
          "version": "sarifregress/derived-fingerprint-compare/v2"
        },
        {
          "name": "embedded-snippet",
          "version": "embedded-snippet/v1"
        },
        {
          "name": "producer-fingerprint-common",
          "version": "sarifregress/producer-fingerprint-common-version/v1"
        }
      ],
      "outputSchemaVersion": "1",
      "configurationSchemaVersion": "1",
      "holdoutManifestSha256": "b9cf6325e2758889449aa021b5b45b3636e17a0dcf65d3c7dba215c2964fe379"
    },
    "aggregate": {
      "groundTruthUnits": 99,
      "labelledRelationships": 75,
      "labelledMatches": 50,
      "truePositives": 50,
      "falsePositives": 0,
      "falseNegatives": 25,
      "classificationMismatches": 0,
      "expectedNewClassifications": 9,
      "newClassifications": 36,
      "correctNewClassifications": 9,
      "incorrectNewClassifications": 0,
      "newClassificationAccuracy": 1,
      "expectedResolvedClassifications": 9,
      "resolvedClassifications": 36,
      "correctResolvedClassifications": 9,
      "incorrectResolvedClassifications": 0,
      "resolvedClassificationAccuracy": 1,
      "ambiguousClassifications": 8,
      "correctAmbiguityRefusals": 4,
      "unexpectedAmbiguityRefusals": 0,
      "incorrectlyAutoMatchedAmbiguousCases": 0,
      "ingestionFailures": 0,
      "structuralFailures": 0,
      "precision": 1,
      "recall": 0.666667,
      "f1": 0.800000
    },
    "producers": [
      {
        "producerId": "gitleaks",
        "metrics": {
          "groundTruthUnits": 33,
          "labelledRelationships": 25,
          "labelledMatches": 25,
          "truePositives": 25,
          "falsePositives": 0,
          "falseNegatives": 0,
          "classificationMismatches": 0,
          "expectedNewClassifications": 3,
          "newClassifications": 3,
          "correctNewClassifications": 3,
          "incorrectNewClassifications": 0,
          "newClassificationAccuracy": 1,
          "expectedResolvedClassifications": 3,
          "resolvedClassifications": 3,
          "correctResolvedClassifications": 3,
          "incorrectResolvedClassifications": 0,
          "resolvedClassificationAccuracy": 1,
          "ambiguousClassifications": 4,
          "correctAmbiguityRefusals": 2,
          "unexpectedAmbiguityRefusals": 0,
          "incorrectlyAutoMatchedAmbiguousCases": 0,
          "ingestionFailures": 0,
          "structuralFailures": 0,
          "precision": 1,
          "recall": 1,
          "f1": 1
        }
      },
      {
        "producerId": "pmd",
        "metrics": {
          "groundTruthUnits": 33,
          "labelledRelationships": 25,
          "labelledMatches": 0,
          "truePositives": 0,
          "falsePositives": 0,
          "falseNegatives": 25,
          "classificationMismatches": 0,
          "expectedNewClassifications": 3,
          "newClassifications": 30,
          "correctNewClassifications": 3,
          "incorrectNewClassifications": 0,
          "newClassificationAccuracy": 1,
          "expectedResolvedClassifications": 3,
          "resolvedClassifications": 30,
          "correctResolvedClassifications": 3,
          "incorrectResolvedClassifications": 0,
          "resolvedClassificationAccuracy": 1,
          "ambiguousClassifications": 0,
          "correctAmbiguityRefusals": 0,
          "unexpectedAmbiguityRefusals": 0,
          "incorrectlyAutoMatchedAmbiguousCases": 0,
          "ingestionFailures": 0,
          "structuralFailures": 0,
          "precision": 1,
          "recall": 0,
          "f1": 0
        }
      },
      {
        "producerId": "semgrep",
        "metrics": {
          "groundTruthUnits": 33,
          "labelledRelationships": 25,
          "labelledMatches": 25,